{
 "version": 1,
 "notes": "Curated populations (DATA_MODEL.md §3). Membership regexes match AADR v66.p1 Group IDs verbatim; the default exclusion (outliers, duplicates, flagged-problematic) is applied unless a rule says otherwise. time_range is computed from members at export unless given here. Descriptions are our own words.",
 "default_exclude_group_label_regex": "-o($|[A-Z0-9_])|_o($|_)|\\.o($|_)|-Dup|DontUse|Ignore",
 "populations": [
  {
   "id": "neandertals",
   "name": "Neandertals",
   "category": "archaic_population",
   "transition": "archaic",
   "aliases": [
    {
     "name": "Neanderthals",
     "used_by": [
      "fu2016",
      "sumer2024",
      "iasi2024"
     ]
    }
   ],
   "description": "An archaic human group of western Eurasia, known from fossils and from several high-quality genomes. Their DNA survives in all present-day people whose ancestry lies largely outside Africa.",
   "genetic_profile": "Sampled genomes range from the Altai Mountains to western Europe. The Neandertals who contributed DNA to modern humans were closer to the western (Vindija, Mezmaiskaya) Neandertals than to the Altai individual.",
   "region": {
    "name": "Western Eurasia to the Altai"
   },
   "membership": {
    "include": [
     {
      "group_label_regex": "_Neanderthal$|^Altai_Neanderthal$"
     }
    ],
    "notes": "AADR labels ending in _Neanderthal. Excludes the Neandertal–Denisovan first-generation offspring (Russia_Denisova_Neanderthal_Mix).",
    "defining_source_ids": [
     "green2010",
     "prufer2014",
     "prufer2017"
    ]
   },
   "inferred_only": false,
   "confidence": "high",
   "evidence_ids": [
    "ev-green2010-1",
    "ev-prufer2014-2",
    "ev-prufer2017-1",
    "ev-fu2016-1"
   ],
   "caveats": [
    "Most sampled Neandertal genomes predate the V1 window; only a few late individuals (about 50,000–40,000 years ago) fall inside it."
   ]
  },
  {
   "id": "denisovans",
   "name": "Denisovans",
   "category": "archaic_population",
   "transition": "archaic",
   "aliases": [],
   "description": "An archaic human group known mainly from genomes recovered at Denisova Cave in the Altai. Denisovan-related DNA survives at the highest levels in people of Oceania and parts of Island Southeast Asia.",
   "genetic_profile": "Related to Neandertals. The Denisovans who contributed DNA to modern humans were only distantly related to the sampled Altai individual; at least two differently related Denisovan sources are detected in present-day East Asians.",
   "region": {
    "name": "Known from the Altai (Denisova Cave); inferred elsewhere in Asia"
   },
   "membership": {
    "include": [
     {
      "group_label_regex": "^Russia_Denisova$|^Russia_DenisovaCave_MPleistocene$"
     }
    ],
    "notes": "Only the genetically Denisovan individuals. Russia_DenisovaCave (a ~24,000-year-old modern human from the same cave) is deliberately excluded.",
    "defining_source_ids": [
     "reich2010"
    ]
   },
   "inferred_only": false,
   "confidence": "high",
   "evidence_ids": [
    "ev-reich2010-1",
    "ev-browning2018-2",
    "ev-larena2021-1",
    "ev-prufer2014-3"
   ],
   "caveats": [
    "All sampled Denisovan genomes predate the V1 window; the populations that admixed with modern humans are unsampled and their locations unknown.",
    "AADR also has a modern human from Denisova Cave; a site is not a population."
   ]
  },
  {
   "id": "non-african-ancestors",
   "name": "Shared ancestors of non-Africans (inferred)",
   "category": "genetic_cluster",
   "transition": "archaic",
   "aliases": [
    {
     "name": "out-of-Africa population",
     "used_by": [
      "sumer2024"
     ]
    }
   ],
   "description": "A modelled population: the common ancestors of nearly all present-day people whose ancestry lies largely outside Africa, who received Neandertal gene flow before dispersing. No individual from it has been sampled and its location is unknown.",
   "region": {
    "name": "Unknown (not located by genetics)"
   },
   "membership": {
    "include": [],
    "notes": "Inferred only.",
    "defining_source_ids": [
     "iasi2024",
     "sumer2024"
    ]
   },
   "inferred_only": true,
   "time_range": {
    "start": -48550,
    "end": -41550
   },
   "time_range_basis": "sources",
   "confidence": "medium",
   "evidence_ids": [
    "ev-iasi2024-1",
    "ev-sumer2024-2",
    "ev-green2010-1"
   ],
   "caveats": [
    "The time range shown is the window of the shared Neandertal gene flow (50,500–43,500 years ago, Iasi et al. 2024), not the population's lifespan."
   ]
  },
  {
   "id": "zlatykun-ranis",
   "name": "Zlatý kůň/Ranis population",
   "category": "genetic_cluster",
   "transition": "early-eurasians",
   "aliases": [],
   "description": "A small population of early modern humans known from two sites in central Europe, about 45,000 years ago. The individuals were closely related to each other, even across sites.",
   "genetic_profile": "The earliest split from the out-of-Africa population sampled so far. No detectable continuity with later Europeans.",
   "archaeological_context": "The Ranis remains are associated with the Lincombian–Ranisian–Jerzmanowician (LRJ) assemblage.",
   "region": {
    "name": "Central Europe (Germany, Czechia)"
   },
   "membership": {
    "include": [
     {
      "group_label_regex": "^Czechia_Zlatykun_IUP$|^Germany_Ranis_IUP$"
     }
    ],
    "notes": "All Ranis and Zlatý kůň individuals.",
    "defining_source_ids": [
     "sumer2024"
    ]
   },
   "inferred_only": false,
   "confidence": "high",
   "evidence_ids": [
    "ev-sumer2024-1",
    "ev-sumer2024-2"
   ],
   "caveats": []
  },
  {
   "id": "bacho-kiro-iup",
   "name": "Bacho Kiro IUP-associated individuals",
   "category": "archaeological_population",
   "transition": "early-eurasians",
   "aliases": [],
   "description": "Individuals from Bacho Kiro Cave in Bulgaria, about 46,000–43,000 years ago, buried with an Initial Upper Palaeolithic stone-tool assemblage. All had Neandertal ancestors only a few generations back.",
   "genetic_profile": "More closely related to later East Asians and Native Americans than to later western Eurasians.",
   "archaeological_context": "Initial Upper Palaeolithic (Bachokirian).",
   "region": {
    "name": "Balkans (Bulgaria)"
   },
   "membership": {
    "include": [
     {
      "group_label_regex": "^Bulgaria_BachoKiroCave_IUP$"
     }
    ],
    "notes": "IUP layers only; the later Bacho Kiro UP individual is not included.",
    "defining_source_ids": [
     "hajdinjak2021"
    ]
   },
   "inferred_only": false,
   "confidence": "high",
   "evidence_ids": [
    "ev-hajdinjak2021-1"
   ],
   "caveats": []
  },
  {
   "id": "ust-ishim",
   "name": "Ust'-Ishim individual",
   "category": "genetic_cluster",
   "transition": "early-eurasians",
   "aliases": [],
   "description": "A single man who lived about 45,000 years ago in western Siberia. His genome comes from a population that lived before, or around the time of, the separation of western and eastern Eurasian populations.",
   "region": {
    "name": "Western Siberia"
   },
   "membership": {
    "include": [
     {
      "group_label_regex": "^Russia_UstIshim_IUP$"
     }
    ],
    "notes": "One individual.",
    "defining_source_ids": [
     "fu2014"
    ]
   },
   "inferred_only": false,
   "confidence": "high",
   "evidence_ids": [
    "ev-fu2014-1",
    "ev-fu2014-2"
   ],
   "caveats": [
    "A single individual: a population of one is a placeholder for an otherwise unsampled group."
   ]
  },
  {
   "id": "oase",
   "name": "Oase 1",
   "category": "genetic_cluster",
   "transition": "early-eurasians",
   "aliases": [],
   "description": "An early modern human from Peştera cu Oase, Romania, about 40,000 years ago, with a Neandertal ancestor only four to six generations back.",
   "region": {
    "name": "Southeastern Europe (Romania)"
   },
   "membership": {
    "include": [
     {
      "group_label_regex": "^Romania_IUP$"
     }
    ],
    "notes": "AADR labels Oase 1 as Romania_IUP.",
    "defining_source_ids": [
     "fu2015"
    ],
    "include_questionable": true
   },
   "inferred_only": false,
   "confidence": "high",
   "evidence_ids": [
    "ev-fu2015-1"
   ],
   "caveats": [
    "A single individual.",
    "AADR flags this individual's data as CRITICAL (quality/contamination warning); it is shown with that warning because it is the subject of the cited study."
   ]
  },
  {
   "id": "tianyuan",
   "name": "Tianyuan individual",
   "category": "genetic_cluster",
   "transition": "early-eurasians",
   "aliases": [],
   "description": "A man who lived about 40,000 years ago near present-day Beijing, more closely related to Asians than to Europeans but with an unexpected link to a 35,000-year-old individual from Belgium.",
   "region": {
    "name": "Northern China"
   },
   "membership": {
    "include": [
     {
      "group_label_regex": "^China_TianyuanCave_UP$"
     }
    ],
    "notes": "One individual.",
    "defining_source_ids": [
     "yang2017"
    ]
   },
   "inferred_only": false,
   "confidence": "high",
   "evidence_ids": [
    "ev-yang2017-1"
   ],
   "caveats": [
    "A single individual."
   ]
  },
  {
   "id": "early-european-founders",
   "name": "Early European founder population (Kostenki/Sunghir-related)",
   "category": "genetic_cluster",
   "transition": "eur-hg",
   "aliases": [],
   "description": "Individuals from western Russia, about 38,000–32,000 years ago, who belong to the founder population that contributed to all later sampled European hunter-gatherers until about 14,000 years ago.",
   "region": {
    "name": "Eastern European Plain"
   },
   "membership": {
    "include": [
     {
      "group_label_regex": "^Russia_Kostenki_UP$|^Russia_Sunghir_UP$"
     }
    ],
    "notes": "Kostenki 14 is the type individual in Fu 2016; Sunghir is grouped with it as related to the Věstonice cluster in Posth 2023.",
    "defining_source_ids": [
     "fu2016",